{
  "directed": false,
  "multigraph": false,
  "graph": {},
  "nodes": [
    {
      "id": "alpha",
      "label": "Alpha",
      "norm_label": "alpha",
      "community": 1,
      "file_type": "doc",
      "source_file": "src/module_a.md",
      "source_location": "L1",
      "source_url": "",
      "_origin": "ast"
    },
    {
      "id": "beta",
      "label": "Beta",
      "norm_label": "beta",
      "community": 1,
      "file_type": "doc",
      "source_file": "src/module_a.md",
      "source_location": "L2",
      "source_url": "",
      "_origin": "ast"
    },
    {
      "id": "gamma",
      "label": "Gamma",
      "norm_label": "gamma",
      "community": 1,
      "file_type": "doc",
      "source_file": "src/module_a.md",
      "source_location": "L3",
      "source_url": "",
      "_origin": "ast"
    },
    {
      "id": "config_a",
      "label": "config",
      "norm_label": "config",
      "community": 2,
      "file_type": "code",
      "source_file": "src/module_a.md",
      "source_location": "L10",
      "source_url": "",
      "_origin": "ast"
    },
    {
      "id": "config_b",
      "label": "config",
      "norm_label": "config",
      "community": 2,
      "file_type": "code",
      "source_file": "src/module_b.md",
      "source_location": "L5",
      "source_url": "",
      "_origin": "ast"
    },
    {
      "id": "config_c",
      "label": "config",
      "norm_label": "config",
      "community": 3,
      "file_type": "code",
      "source_file": "src/module_b.md",
      "source_location": "L8",
      "source_url": "",
      "_origin": "ast"
    },
    {
      "id": "delta",
      "label": "Delta",
      "norm_label": "delta",
      "community": 2,
      "file_type": "doc",
      "source_file": "src/module_b.md",
      "source_location": "L15",
      "source_url": "",
      "_origin": "ast"
    },
    {
      "id": "epsilon",
      "label": "Epsilon",
      "norm_label": "epsilon",
      "community": 3,
      "file_type": "doc",
      "source_file": "src/module_b.md",
      "source_location": "L20",
      "source_url": "",
      "_origin": "ast"
    }
  ],
  "links": [
    {
      "source": "alpha",
      "target": "beta",
      "relation": "requires",
      "confidence": "EXTRACTED",
      "confidence_score": 1.0,
      "weight": 1.0,
      "source_file": "src/module_a.md",
      "source_location": "L1"
    },
    {
      "source": "beta",
      "target": "config_a",
      "relation": "uses",
      "confidence": "EXTRACTED",
      "confidence_score": 1.0,
      "weight": 1.0,
      "source_file": "src/module_a.md",
      "source_location": "L2"
    },
    {
      "source": "gamma",
      "target": "config_b",
      "relation": "uses",
      "confidence": "EXTRACTED",
      "confidence_score": 1.0,
      "weight": 1.0,
      "source_file": "src/module_b.md",
      "source_location": "L5"
    },
    {
      "source": "delta",
      "target": "config_c",
      "relation": "extends",
      "confidence": "EXTRACTED",
      "confidence_score": 1.0,
      "weight": 1.0,
      "source_file": "src/module_b.md",
      "source_location": "L15"
    },
    {
      "source": "epsilon",
      "target": "delta",
      "relation": "related-to",
      "confidence": "EXTRACTED",
      "confidence_score": 0.8,
      "weight": 0.8,
      "source_file": "src/module_b.md",
      "source_location": "L20"
    }
  ]
}
